Crime ID,Month,Reported by,Falls within,Longitude,Latitude,Location,LSOA code,LSOA name,Outcome type
117f24649fe2e05ab8cae1e0dea2058f8d363c4cfd60372a815d5dc3bd49bfef,2016-04,North Wales Police,North Wales Police,-3.827990,53.280481,On or near Shopping Area,W01000130,Conwy 012C,Suspect charged
6ef8b3eb82f6bc0d435dc08cd75267433219d3709237694ec949e47f4d2b65a2,2016-04,North Wales Police,North Wales Police,-2.983306,53.050390,On or near PARKLEIGH COURT,W01000393,Wrexham 009C,Unable to prosecute suspect
efaeddf1bef5957e368d6168df885df067fbad22cc404b08cccd5ed251c10ba4,2016-04,North Wales Police,North Wales Police,-3.060885,53.183387,On or near KIPLING CLOSE,W01000286,Flintshire 013E,Unable to prosecute suspect
8b15cd79bda70b597687082442c38b2f9c67d3f365bccd51661f1ac5a6042b96,2016-04,North Wales Police,North Wales Police,-3.146117,53.239230,On or near ELWY CRESCENT,W01000291,Flintshire 005B,Suspect charged
6372727539d037e72d61838a12d72fe8fd72f4e20b68f8f3371e9d2b120d4eaa,2016-04,North Wales Police,North Wales Police,-3.677433,53.286488,On or near CAE GLAS,W01000163,Conwy 009E,Unable to prosecute suspect
af2e1a388de61c3bbcd058578f38eaa303844894926d097ab18943c3d682c3cc,2016-04,North Wales Police,North Wales Police,-3.146117,53.239230,On or near ELWY CRESCENT,W01000291,Flintshire 005B,Suspect charged
41378ad76a9f25645afd8e33663a5ba140da83b07a5023635dc56cf3f30691d7,2016-04,North Wales Police,North Wales Police,-4.059489,52.725212,On or near NORTHFIELD ROAD,W01000048,Gwynedd 016A,Local resolution
79fb82f6538d9ebffd50ddd39456d12a47e83ecb64a9e2360892ca1fa7c85388,2016-04,North Wales Police,North Wales Police,-4.092743,53.211359,On or near DOL-HELYG,W01000050,Gwynedd 003A,Unable to prosecute suspect
3bb3dc428f7b1288b9688f1938a3c2cce5013507fd8fe10a27b6f36841b319f2,2016-04,North Wales Police,North Wales Police,-3.764340,53.293064,On or near ORME ROAD,W01000167,Conwy 011C,Unable to prosecute suspect
8fd0717c08d3cf357fce4266aee7a148312c04f6a144273c3f930246bc2ce26d,2016-04,North Wales Police,North Wales Police,-4.137527,53.218062,On or near GER NANT,W01000075,Gwynedd 002C,Unable to prosecute suspect
f4468283467e6f58ad1dd987b411b840c851ae76efdc4546e9cd29967f2dc49b,2016-04,North Wales Police,North Wales Police,-2.930594,53.178085,On or near Shopping Area,W01000329,Flintshire 015D,Investigation complete; no suspect identified
35c62842ce2d2eb24071da8ca03b0cc7fe7e6cfb27f947e6abab1c96dabb53cd,2016-04,North Wales Police,North Wales Police,-2.988667,53.049303,On or near A5152,W01000393,Wrexham 009C,Investigation complete; no suspect identified
f4ea7306e221b1db6577251ccb85212fcd6f8f575c9e7f6481b31fda0f54e560,2016-04,North Wales Police,North Wales Police,-3.458506,53.203328,On or near GLASFRYN,W01000199,Denbighshire 011C,Formal action is not in the public interest
5cde62aa24af4be252da11f99f2934fec01e9c4cf2769ed0b4e31c20ca28c703,2016-04,North Wales Police,North Wales Police,-4.125649,53.225916,On or near STRYD ISAF,W01000062,Gwynedd 001A,Suspect charged
5a8b4b57209c403d182731672a27c409e11c79b78ae128cedd61e92fe77529a5,2016-04,North Wales Police,North Wales Police,-2.993193,53.046316,On or near Shopping Area,W01000372,Wrexham 008C,Investigation complete; no suspect identified
363cf0359546cf5e75a29b536fce779058f56a55ec7f58900eed6294534912f2,2016-04,North Wales Police,North Wales Police,-4.123283,53.227451,On or near Parking Area,W01000062,Gwynedd 001A,Suspect charged
8f34be332b323557136eea08ca457a3ab76a51ca4b7e757c8ff21aa309856565,2016-04,North Wales Police,North Wales Police,-3.041418,53.202598,On or near Hospital,W01000335,Flintshire 009D,Formal action is not in the public interest
4646beedf97f2e181a4099ff0da8a45e5b6ed028ee7e6f1de516fb1739cb72db,2016-04,North Wales Police,North Wales Police,-3.134818,53.167226,On or near THE AVENUE,W01000315,Flintshire 016C,Unable to prosecute suspect
e78a592e80514137575d0e8f4b96259965a3b47977ee3dff5936085fc87e2a59,2016-04,North Wales Police,North Wales Police,-3.059700,52.981494,On or near OGWEN,W01000409,Wrexham 017E,Unable to prosecute suspect
2e3c91f7cf76026387b38bce7140e65ac3cafab5edaf63546b140a80b4896532,2016-04,North Wales Police,North Wales Police,-4.624344,53.309016,On or near TY-MAWR,W01000033,Isle of Anglesey 003E,Investigation complete; no suspect identified
3c1e77534691fea356ed74af780831539344d4e0feb6343342fca634a7565776,2016-04,North Wales Police,North Wales Police,-3.750034,53.301716,On or near ARRAN DRIVE,W01000154,Conwy 003A,Unable to prosecute suspect
056c0bf68eb42576be54745ac7008e221f42fba4b229c9772aba1143e2ff8053,2016-04,North Wales Police,North Wales Police,-3.024272,53.073651,On or near HEOL-YR-EGLWYS,W01000378,Wrexham 004B,Action to be taken by another organisation
3a0f90b0dd1d4ee070b3bcbaa16fcab76ca709c59625d5ae1d26003760cd68a2,2016-04,North Wales Police,North Wales Police,-4.112750,53.227755,On or near PLAS Y GERDDI,W01000091,Gwynedd 001D,Unable to prosecute suspect
ad42e01fbddb729c9cb6a0ffdfc19a06b54fde5e36b784eebcf8a0fe422f706d,2016-04,North Wales Police,North Wales Police,-3.822925,53.291499,On or near PARK ROAD,W01000136,Conwy 006B,Unable to prosecute suspect
4c72e02a9c0d110902112866ebbe304789dcf61c9b2f98ce50d0287a122cac13,2016-04,North Wales Police,North Wales Police,-3.427306,53.185816,On or near BLAEN-Y-COED,W01000198,Denbighshire 011B,Suspect charged
4c72e02a9c0d110902112866ebbe304789dcf61c9b2f98ce50d0287a122cac13,2016-04,North Wales Police,North Wales Police,-3.427306,53.185816,On or near BLAEN-Y-COED,W01000198,Denbighshire 011B,Suspect charged
587bbdd0c8f1a0fe4ebd7d39275905acf5bcb7dacec3236c799184c1941dc153,2016-04,North Wales Police,North Wales Police,-2.997331,53.046561,On or near Shopping Area,W01000350,Wrexham 011B,Suspect charged
57dedb07ef5de71e52531536bd2eba8aafeab0482c2130860b004862dc1e8eb7,2016-04,North Wales Police,North Wales Police,-3.062337,52.981551,On or near TEGID,W01000409,Wrexham 017E,Suspect charged
fd4d11aa2954d55258f6390f3e005481e7fdcdf0da31507c08acd548512115a3,2016-04,North Wales Police,North Wales Police,-3.715615,53.291042,On or near Sports/Recreation Area,W01000144,Conwy 007C,Local resolution
df7696950c1640cd1e787a99e42269745c5c399e81cd3d9da0a16946e4598ba6,2016-04,North Wales Police,North Wales Police,-3.428361,53.184707,On or near LLOYD AVENUE,W01000198,Denbighshire 011B,Suspect charged
6c9e611f67307b958ab4364b6abb7df2110be7db31220d19cdf3683dc4b2cc65,2016-04,North Wales Police,North Wales Police,-3.797573,53.139259,On or near PLOUGH FIELD,W01000134,Conwy 015B,Investigation complete; no suspect identified
2f39a4aa4495aefbbddf32f3f8b6d6e3595c67a195a6455c52a8171eaea5fdc5,2016-04,North Wales Police,North Wales Police,-4.133852,52.929416,On or near STRYD FAWR,W01000105,Gwynedd 010C,Unable to prosecute suspect
cb85fd1bc63454c7023d2e656862aa9451137ab2529d4a3a6d2c6773eb2a5f20,2016-04,North Wales Police,North Wales Police,-3.086985,53.168661,On or near SOUTH LANE,W01000264,Flintshire 012A,Suspect charged
573cd0a3b51233605d8ae7f9fb8d9335dc62213fc85ec33dd7e641c4fd220872,2016-04,North Wales Police,North Wales Police,-3.478161,53.257590,On or near FFORDD RICHARD DAVIES,W01000191,Denbighshire 009A,Suspect charged
ceeedf668a02de35bf190aa0914095cd5bc24a8bde86c9dd4b26cc328b3532ee,2016-04,North Wales Police,North Wales Police,-3.428744,53.335601,On or near FERGUSON AVENUE,W01000219,Denbighshire 001B,Offender given a caution
bfc8e6e05018ad793d485bb1df1a916108a4725bbaf1793927171f90cae3da9a,2016-04,North Wales Police,North Wales Police,-3.416335,53.311010,On or near Shopping Area,W01000201,Denbighshire 008B,Suspect charged
104b944d386232eb31d32f64714fd3cbd6a68fb6b19a85f757893528da89504b,2016-04,North Wales Police,North Wales Police,-3.135455,53.249113,On or near Supermarket,W01000290,Flintshire 004B,Unable to prosecute suspect
1dc3aadb92875cec63dfbecea08b79f0de9a4dfe4e270f01235a7da5af7245aa,2016-04,North Wales Police,North Wales Police,-4.167790,53.229436,On or near TYDDYN MOSTYN,W01000042,Isle of Anglesey 008D,Suspect charged
e8412576c7b255bcc95ea44a3093f8b92d04568678670866c1d74c9d54b52e40,2016-04,North Wales Police,North Wales Police,-3.493103,53.320277,On or near WATER STREET,W01000240,Denbighshire 004E,Suspect charged
4aacece66e60cd3ff0e0a223348df040aa32b6f8f38b4f1bbb4a127262f0f469,2016-04,North Wales Police,North Wales Police,-3.489794,53.320947,On or near Shopping Area,W01000240,Denbighshire 004E,Local resolution
c2a41ba5a7ed33896eaa92efe0720ef3adbbfaaaa40752babf9c531fcad1b838,2016-04,North Wales Police,North Wales Police,-3.489794,53.320947,On or near Shopping Area,W01000240,Denbighshire 004E,Suspect charged
6333f223273a041a9e7dad6590f2b0bc1112bd538caf7caada3f01fd6941588a,2016-04,North Wales Police,North Wales Police,-3.174120,53.267588,On or near PEN-Y-GLYN,W01000254,Flintshire 003B,Unable to prosecute suspect
3564410948f17db316bdfd37fd4c15b05f545b7ad13b461985b7cec2507661c4,2016-04,North Wales Police,North Wales Police,-3.423552,53.182283,On or near GLAS MEADOW LANE,W01000199,Denbighshire 011C,Suspect charged
655844d2a1aab36b7e13ff7c552decee6e212812dfeec22555a29e78c81d05fb,2016-04,North Wales Police,North Wales Police,-3.416358,53.326669,On or near BANGOR CRESCENT,W01000222,Denbighshire 003C,Unable to prosecute suspect
0853c72e070be7fecc24e480233002833098df7a197d6f5d02d51a62e0443b1d,2016-04,North Wales Police,North Wales Police,-4.202862,53.221205,On or near Petrol Station,W01000015,Isle of Anglesey 008C,Investigation complete; no suspect identified
6215021beb955b2b7b4d9dabfcbd487e068f09825dcd7674b2f1dc2621435908,2016-04,North Wales Police,North Wales Police,-4.423793,52.880720,On or near Parking Area,W01000109,Gwynedd 012E,Investigation complete; no suspect identified
5ae30b58b6ba093ce2bd5fbbf032d4e64a342971ed2e3a14f42b8ef18c56f28f,2016-04,North Wales Police,North Wales Police,-3.059941,53.174217,On or near DAULWYN ROAD,W01000268,Flintshire 013B,Local resolution
1d0a9833d0817f4b9dafef277b08877c514f62c9011e6b34aa9a2eff7e3ac414,2016-04,North Wales Police,North Wales Police,-3.021476,53.207616,On or near STATION ROAD,W01000328,Flintshire 011C,Investigation complete; no suspect identified
460e531b51424339c979b45ce3ae030fd9f2e8a2856b8309acd2b643f540106f,2016-04,North Wales Police,North Wales Police,-2.980512,53.058728,On or near STRATFORD CLOSE,W01000341,Wrexham 009A,Unable to prosecute suspect
c5abbd7cacef9383e69414dff60946c70bf9b0f83ffd771d19c882a844f4d3b0,2016-04,North Wales Police,North Wales Police,-3.684368,53.292305,On or near GLAN-Y-MOR ROAD,W01000127,Conwy 009B,Unable to prosecute suspect
a6fcc08bbd8a1d8c1bdfb4312cedf5d4166f1c2c2289f9f0447c3bfe2e7e4f04,2016-04,North Wales Police,North Wales Police,-4.286180,53.051998,On or near BRYN LLWYD,W01000104,Gwynedd 008C,Unable to prosecute suspect
d12984988e3ee6a8309a737d832527114f60adbd341dc3c503f33a51ba0b281c,2016-04,North Wales Police,North Wales Police,-3.499941,53.318330,On or near WEST PARADE,W01000239,Denbighshire 004D,Unable to prosecute suspect
a689ec4f5592a8c8874ceb9f83b225e9860d3aaeebbd3a445ff469301b171733,2016-04,North Wales Police,North Wales Police,-3.812069,53.321071,On or near PLEASANT STREET,W01000132,Conwy 001A,Unable to prosecute suspect
680f08e6d4c4cfaa481e488b4c866f815c9d2768e2655aef2ba9a6f1e65b1518,2016-04,North Wales Police,North Wales Police,-3.562586,53.297299,On or near HOLLAND DRIVE,W01001927,Conwy 010G,Suspect charged
1ca8349406855729c097c346511a48becc20621a0277b876d1f5eece9adfd9f1,2016-04,North Wales Police,North Wales Police,-2.965850,53.037615,On or near PENTRE GWYN,W01000423,Wrexham 012D,Unable to prosecute suspect
4e3867a53107cee5779d4fe443bbc5f3305c2aeb5c41e76f432f5252e2df8499,2016-04,North Wales Police,North Wales Police,-3.096279,53.166472,On or near LANGFORD CRESCENT,W01000261,Flintshire 014C,Unable to prosecute suspect
313ac86cf9ab4e4f3efc12ef534178c39fd0760b9bda261fd68759575387a8a2,2016-04,North Wales Police,North Wales Police,-4.123833,53.228583,On or near STRYD PANTON,W01000062,Gwynedd 001A,Offender given penalty notice
2add4417cecfa3f71f02f85d7fc14ba0b1c6d6a1e86f0ab56808e69b82d2e370,2016-04,North Wales Police,North Wales Police,-3.337411,53.175407,On or near PARC TY'N LLAN,W01000206,Denbighshire 013C,Unable to prosecute suspect
0601949195584a6f8cdd609c9040b8f1fe8e3a0b09a1b81678e88ae20576e85a,2016-04,North Wales Police,North Wales Police,-3.189049,53.276610,On or near CAE'R FFYNNON,W01000254,Flintshire 003B,Unable to prosecute suspect
b39d34ab196cd6c94742485720f541441cd15f0e6967ebf2ed6d84515a1d9909,2016-04,North Wales Police,North Wales Police,-4.635914,53.302368,On or near TRESEIFION ROAD,W01000030,Isle of Anglesey 003D,Unable to prosecute suspect
917de25118e026beb22eb8082b8ed035a048ca923915b40e7e81da510a2e8020,2016-04,North Wales Police,North Wales Police,-4.635914,53.302368,On or near TRESEIFION ROAD,W01000030,Isle of Anglesey 003D,Unable to prosecute suspect
795522223805486f6278dcd69a31024638995e77cdd04d284b622c6f9f930c73,2016-04,North Wales Police,North Wales Police,-4.635914,53.302368,On or near TRESEIFION ROAD,W01000030,Isle of Anglesey 003D,Unable to prosecute suspect
683a0a03340e92bb469cb980c55b1b736cb5423ef3516206ca575c550661f41b,2016-04,North Wales Police,North Wales Police,-3.423615,53.326808,On or near LON BRYNLI,W01000221,Denbighshire 003B,Suspect charged
00e0f41f55d600979708861216a547688f41f8054038d39f206b39ab9e98cf0e,2016-04,North Wales Police,North Wales Police,-3.306212,53.326839,On or near COED MOR,W01000287,Flintshire 001A,Unable to prosecute suspect
d9cfdfebfaea33423058e0876575990b04f78cea8927586cd5707d79ab4a9ef2,2016-04,North Wales Police,North Wales Police,-2.938366,53.034302,On or near PILGRIM WAY,W01000383,Wrexham 020A,Unable to prosecute suspect
17186ab673837f8a589cb000ed99d5086136261de023ad5d332c67ebbe5a19eb,2016-04,North Wales Police,North Wales Police,-4.493457,52.880212,On or near LON PIN,W01000070,Gwynedd 012A,Unable to prosecute suspect
09e392415542fd382f994eb7d174af6cafd92f69a6b6699c3921f8093b504d33,2016-04,North Wales Police,North Wales Police,-3.039748,52.987999,On or near MAELOR PLACE,W01000420,Wrexham 016E,Unable to prosecute suspect
b5c0f81829750cfb67cd7416f0a3a45788358dc21e2b92eed1edeb17290d841d,2016-04,North Wales Police,North Wales Police,-3.487310,53.323351,On or near FAIRFIELD AVENUE,W01000228,Denbighshire 004C,Unable to prosecute suspect
53df9378bff7f851994c67e77a1992d995463c43b18e86198e8c9b2968da1f44,2016-04,North Wales Police,North Wales Police,-3.751012,53.313128,On or near CYSGOD-Y-BRYN,W01000157,Conwy 004C,Unable to prosecute suspect
2dba29f94b454fbe09e07a74cba989c2d906567b9d0484ef8a196c8d379cdf7b,2016-04,North Wales Police,North Wales Police,-4.113998,53.226321,On or near LON Y PARC,W01000091,Gwynedd 001D,Unable to prosecute suspect
cb046bb2c3ec8c31795eb020c17732adacfc9cc5044e9699952aac107e4ae4bf,2016-04,North Wales Police,North Wales Police,-4.630898,53.303063,On or near MAES Y BRENIN,W01000017,Isle of Anglesey 003B,Investigation complete; no suspect identified
7a2f5118c621cd01e4105ad7585f90ca023704f20ed9a29985c0c005cfecb966,2016-04,North Wales Police,North Wales Police,-3.462328,53.328227,On or near RHYL COAST ROAD,W01000226,Denbighshire 004A,Unable to prosecute suspect
89ca93e104409726d11a7b8410a73a5c869ebcdbe6803504568631a1aecb220e,2016-04,North Wales Police,North Wales Police,-3.813272,53.283241,On or near Supermarket,W01000166,Conwy 006D,Suspect charged
692a0f998d3ea7e3f7a38053ed36682d396b3123bf06647f587eed41223ffb10,2016-04,North Wales Police,North Wales Police,-4.114116,53.227191,On or near FFORDD TAN Y BRYN,W01000091,Gwynedd 001D,Investigation complete; no suspect identified
644a563b94eafd1384b249819b49c06b0c2839e890348c94873d959a97866c42,2016-04,North Wales Police,North Wales Police,-3.391650,53.334277,On or near ABERCONWAY ROAD,W01000215,Denbighshire 002C,Unable to prosecute suspect
6c01ccdda07fafda25a3e5fc53af7a34ec0ca60d89b3da63ed75bbf9fe2598d9,2016-04,North Wales Police,North Wales Police,-4.401621,52.896923,On or near LON NANT-STIGALLT,W01000047,Gwynedd 011A,Suspect charged
b271f1ee046e2f8fa3103ba9f1b7e96ca3b58f54f2a914fd7b8deeac432ab4b5,2016-04,North Wales Police,North Wales Police,-3.462758,53.290744,On or near PRINCES ROAD,W01000225,Denbighshire 009D,Unable to prosecute suspect
d1ee157f7bb4897a94253e53e9bb148f820de19cc1c8b88dcaa4b131b22bebec,2016-04,North Wales Police,North Wales Police,-3.830097,53.323798,On or near REFORM STREET,W01000169,Conwy 001D,Formal action is not in the public interest
b5f0522cb182700b678e4c4405b66175e793a1f3972e9c4c61d902b4baa279db,2016-04,North Wales Police,North Wales Police,-3.462486,53.293346,On or near RHYL ROAD,W01000224,Denbighshire 009C,Suspect charged
21bb189bc5809deb318a9927f238cc9c24db574ba9a11a6bfd44554f26bfe8ad,2016-04,North Wales Police,North Wales Police,-4.423773,52.880909,On or near HEOL HAMDDEN,W01000109,Gwynedd 012E,Local resolution
e1b9aefb10c5d59a4b387f0742d39edb7dc4099b41b65a36e2e5bb452fba7850,2016-04,North Wales Police,North Wales Police,-3.014408,53.202525,On or near LYONS YARD,W01000328,Flintshire 011C,Unable to prosecute suspect
2d931965c7811dc2c802e38cbc07d25d963b4c2446bba0782c353d2b6981fcdc,2016-04,North Wales Police,North Wales Police,-3.418653,53.185281,On or near LON ABRAM,W01000194,Denbighshire 011A,Unable to prosecute suspect
ca437d1df278d4112f5ba0a39d69ec30004f724fcc2802371146d92b94d85ca3,2016-04,North Wales Police,North Wales Police,-3.431691,53.334801,On or near Park/Open Space,W01000220,Denbighshire 001C,Suspect charged
a8688478fa327bec1f7a29a0bba8197456d9dbedc048b51a19a6193c0cc1f1ab,2016-04,North Wales Police,North Wales Police,-3.054552,53.013543,On or near CRAIGLE,W01000411,Wrexham 015C,Unable to prosecute suspect
f3335020797630e56ec9118c54a7b05350a00ef0cc1c6917e169588923dc3f8c,2016-04,North Wales Police,North Wales Police,-3.732794,53.299927,On or near SEA BANK ROAD,W01000182,Conwy 007D,Unable to prosecute suspect
0d2734580166efcbeb36dcea5abc4b86246ab863f55c4cc4461ad578b0f13e49,2016-04,North Wales Police,North Wales Police,-4.091308,53.278085,On or near STRYD LLEWELYN,W01000005,Isle of Anglesey 005A,Investigation complete; no suspect identified
4a32140afbbb73400a9170aea56332ba3c052f3c0f9924974a69e6f0d21e743c,2016-04,North Wales Police,North Wales Police,-3.058219,53.001365,On or near FFORDD LLANERCH,W01000406,Wrexham 013C,Unable to prosecute suspect
cafe4f0ba7bc7c28d3ec4392b8621a793cbb036f820a5a9ea07160e9d88a5844,2016-04,North Wales Police,North Wales Police,-4.257509,53.145989,On or near CAE BOLD,W01000059,Gwynedd 006A,Suspect charged
ed4407a998397855391797013c8a07f5fd10f9be1cfde51e154e4d3438c6714c,2016-04,North Wales Police,North Wales Police,-3.059700,52.981494,On or near OGWEN,W01000409,Wrexham 017E,Offender given a caution
e9a150e999b4a50c3a01c1585f958e8a20616ffbfcc64082b30e2b9565f6ea57,2016-04,North Wales Police,North Wales Police,-4.633520,53.302735,On or near LLYS TRESEIFON,W01000030,Isle of Anglesey 003D,Suspect charged
e9a150e999b4a50c3a01c1585f958e8a20616ffbfcc64082b30e2b9565f6ea57,2016-04,North Wales Police,North Wales Police,-4.633520,53.302735,On or near LLYS TRESEIFON,W01000030,Isle of Anglesey 003D,Suspect charged
f4704e7b1cd3e1b3b3975b8eae0b92b92e3b7797f5c0f0e4ee3f79f9e06a352c,2016-04,North Wales Police,North Wales Police,-3.445526,53.259842,On or near BRYN ARTHUR,W01000245,Denbighshire 010A,Local resolution
62bf10d1dde8f0fc9d3bf772c84ce5505650bbb3ffce35bbaeef981d7ed73153,2016-04,North Wales Police,North Wales Police,-4.130154,53.224937,On or near ST PAUL'S TERRACE,W01000062,Gwynedd 001A,Unable to prosecute suspect
f10d91bbdf92e8634fb2098847572ed5a53e8dd74d38e6c10a1e591563fd51ac,2016-04,North Wales Police,North Wales Police,-2.996777,53.197568,On or near Sports/Recreation Area,W01000328,Flintshire 011C,Unable to prosecute suspect
6760ad25d02907e837dd66edbd148eea6d74f650194ffcb1bebb2ea69a933466,2016-04,North Wales Police,North Wales Police,-3.738961,53.309151,On or near RHOS PROMENADE,W01000155,Conwy 004A,Unable to prosecute suspect
6760ad25d02907e837dd66edbd148eea6d74f650194ffcb1bebb2ea69a933466,2016-04,North Wales Police,North Wales Police,-3.738961,53.309151,On or near RHOS PROMENADE,W01000155,Conwy 004A,Unable to prosecute suspect
5fd6767128757d6b004cdb0a7cee88265a1cd171e20ce34caf4c4d7c879dde15,2016-04,North Wales Police,North Wales Police,-3.720613,52.948033,On or near A4212,W01000083,Gwynedd 015D,Offender given a caution
4f8aac168c0aefb124c339fff8b4c09dfb4bd2ce3aee2067934ee63c477ec46a,2016-04,North Wales Police,North Wales Police,-3.714199,53.286783,On or near FFORDD PANDY,W01000145,Conwy 008B,Suspect charged
0d970ef6635932bdba4ce659e061d56f082b6058d8e3fc5a4af71450007179e9,2016-04,North Wales Police,North Wales Police,-3.063651,53.221953,On or near CHURCH ROAD,W01000275,Flintshire 007C,Suspect charged
55cff6f7a8356efbf6b0fe306da04320445aada37fbd13b08bb0ef0428a8f23e,2016-04,North Wales Police,North Wales Police,-3.074790,52.972558,On or near CRANE STREET,W01000355,Wrexham 017B,Suspect charged
c18788b513dfae34d77c09576ae9854c2706e4160dae0010335eee2aa6fbcabf,2016-04,North Wales Police,North Wales Police,-3.523960,53.301440,On or near CYNLAS,W01000151,Conwy 005C,Unable to prosecute suspect
559fe780c85f0d6978db50e1b9d92c24a8e3685672108a11a1f1e007f061b94f,2016-04,North Wales Police,North Wales Police,-3.815698,53.285613,On or near NEW ROAD,W01000165,Conwy 006C,Offender given a caution
f43f646c341a59650531faa22003287cca29afe03a896a582c05fa3c3b58834d,2016-04,North Wales Police,North Wales Police,-3.073874,52.974688,On or near ROCK PLACE,W01000355,Wrexham 017B,Unable to prosecute suspect
b46fd9fea8c5e77af801de6a60e4fe459ddbaa706bfbbfe83d7431fff813cb20,2016-04,North Wales Police,North Wales Police,-3.128924,53.241830,On or near FFORDD LLEWELYN,W01000293,Flintshire 004D,Formal action is not in the public interest
0ad23efb1263e923692354a99f8d5b5c19b7d1ca4026b7b62ee9dc0ef2c8572b,2016-04,North Wales Police,North Wales Police,-3.833488,53.327576,On or near TAN-YR-OGOF ROAD,W01000146,Conwy 001B,Investigation complete; no suspect identified
f2c96afd35c7977694ee51dc2cc0343f022f56fb01ae9b6fe08492187616ecf9,2016-04,North Wales Police,North Wales Police,-3.478161,53.257590,On or near FFORDD RICHARD DAVIES,W01000191,Denbighshire 009A,Suspect charged
616c264442487bb690a1764adfe61520bc2b56db9780e26229e29dcd5e8feaa5,2016-04,North Wales Police,North Wales Police,-3.481869,53.316254,On or near VALE PARK,W01000236,Denbighshire 006A,Suspect charged
01242af03fe2f0edfae492b6f1f4efb4e0ddc74e05061bd038ca92ea796e816a,2016-04,North Wales Police,North Wales Police,-3.796123,53.217702,On or near HEOL FFYNNON ASA,W01000137,Conwy 015C,Unable to prosecute suspect
acfb8c61612098845f50b5cc49f7ce95cb461b4e8723fdc67c3f6b8c4ea0a42f,2016-04,North Wales Police,North Wales Police,-3.425742,53.183354,On or near MAES MATHONWY,W01000198,Denbighshire 011B,Investigation complete; no suspect identified
5117171cb99a15081f7cf5129da3a90dfb5a66e6cc8a1907a9f9dba8a6014f57,2016-04,North Wales Police,North Wales Police,-3.072641,53.053510,On or near BRYN CLYWEDOG,W01000363,Wrexham 006D,Offender given a caution
a0e442a84bb8b43128dc46423479538b135aa4dc63245a25504b04525ebdd0de,2016-04,North Wales Police,North Wales Police,-3.812780,53.291798,On or near Sports/Recreation Area,W01000165,Conwy 006C,Unable to prosecute suspect
61af346ed953fee7b0a355731e4d518c9bc35d4c7bb2769a5c1985dd6bcfaea8,2016-04,North Wales Police,North Wales Police,-3.478161,53.257590,On or near FFORDD RICHARD DAVIES,W01000191,Denbighshire 009A,Suspect charged
60699701867d9239bea97de8bdb331c7473b66a217aac1319e7dbfb6b32a9ab8,2016-04,North Wales Police,North Wales Police,-2.976914,53.050074,On or near MOORLAND AVENUE,W01000425,Wrexham 010E,Unable to prosecute suspect
18fcd3d000ad45b5c02f45fd0511299c33c536146077c53addc4af8d5f30babe,2016-04,North Wales Police,North Wales Police,-4.118785,53.219799,On or near MIN-Y-DDOL,W01000090,Gwynedd 002D,Unable to prosecute suspect
ff059ca6cfbd891532c1e2466884de9c34c91b7b6dd8777030eb24921c6125ca,2016-04,North Wales Police,North Wales Police,-2.985362,53.161985,On or near GALA CLOSE,W01000257,Flintshire 015C,Unable to prosecute suspect
2cf7dc6a44ae753b47515275a3c410acc03cfa9a73ba851b8ed6f19ed0716a26,2016-04,North Wales Police,North Wales Police,-2.985362,53.161985,On or near GALA CLOSE,W01000257,Flintshire 015C,Unable to prosecute suspect
f804b7ee1124c94218d5f7f0d1dde696f0aaebaf5c421ea3d477273c45e85064,2016-04,North Wales Police,North Wales Police,-4.369437,53.328138,On or near BRYN CIR,W01000028,Isle of Anglesey 001D,Local resolution
20240c76a2ecbe34e11bc96e9e01b16448b092ba54b7a4a90be013164678637e,2016-04,North Wales Police,North Wales Police,-3.400509,53.324591,On or near CALTHORPE DRIVE,W01000212,Denbighshire 003A,Unable to prosecute suspect
86c7b6b7ec749a1faab61d8f123d54951e81885731ff504b0882e535400679f0,2016-04,North Wales Police,North Wales Police,-4.258505,53.143012,On or near CAE LLWYBR,W01000059,Gwynedd 006A,Unable to prosecute suspect
550bee4b14dbf6ab59df112334bbe6bb654436d4f5c93d4f429556ac62a61891,2016-04,North Wales Police,North Wales Police,-3.025045,53.054649,On or near HALL VIEW,W01000400,Wrexham 005C,Unable to prosecute suspect
b44693723ff570da3c6c57259e0c8ee9767a01d67a6533cc0ccdb2aeac1dd6fd,2016-04,North Wales Police,North Wales Police,-3.933252,52.994688,On or near Blaenau Ffestiniog Police Station,W01000065,Gwynedd 009B,Suspect charged
0300ddb30c28b48ad26b172376b7018a7e183be0c99d5de5c5f35441e0a9a2f0,2016-04,North Wales Police,North Wales Police,-3.145588,53.255892,On or near A548,W01000289,Flintshire 005A,Offender given a caution
aa5946094f96b0df529c7d40ac3d2ad02e76ba3d0c0924167872abf11da3aa07,2016-04,North Wales Police,North Wales Police,-3.351098,53.350304,On or near Sports/Recreation Area,W01000287,Flintshire 001A,Suspect charged
5694d5095ebd31c7e4b2e8d43e82ea376decd90d2c9b637919b57a7ab44714ad,2016-04,North Wales Police,North Wales Police,-3.306212,53.326839,On or near COED MOR,W01000287,Flintshire 001A,Suspect charged
