Crime ID,Month,Reported by,Falls within,Longitude,Latitude,Location,LSOA code,LSOA name,Outcome type
e1e84214b5428362d4ba161b1af00057263429cdfaf39e130b4d0e67941885db,2016-04,North Wales Police,North Wales Police,-3.133474,53.249563,On or near TRELAWNY SQUARE,W01000288,Flintshire 004A,Investigation complete; no suspect identified
0b9708ea7970878a4d5827e910d3af05bc2c6505c7cdb4fbf8c6c93531f009fc,2016-04,North Wales Police,North Wales Police,-3.003757,53.230419,On or near DRIVE A,W01000332,Flintshire 009A,Unable to prosecute suspect
3025e9c58319c454401da9c4d128c355436a7a324a5a5b7e0de9e9744173198b,2016-04,North Wales Police,North Wales Police,-2.967054,53.038765,On or near COED-Y-BRYN,W01000423,Wrexham 012D,Investigation complete; no suspect identified
ca23214514c1fdc1316f0a3fdab554b861f1ea85001a7306427d0d7554868586,2016-04,North Wales Police,North Wales Police,-2.970533,53.046252,On or near BURNHAM GARDENS,W01000353,Wrexham 010B,Suspect charged
d70f2ee4d020ba6fb2c1ce62cac9e2977f83e97b9633b28068ec5ceaf7f59f8e,2016-04,North Wales Police,North Wales Police,-3.223756,53.273553,On or near Supermarket,W01000304,Flintshire 003E,Unable to prosecute suspect
f3449c8cff4c75f732ecde63098549f26c07944f7f9181e025e04ef442d0ea7c,2016-04,North Wales Police,North Wales Police,-3.048754,53.143717,On or near FAIRVIEW,W01000326,Flintshire 018B,Unable to prosecute suspect
5858bf806ebe7d7edea87db963ea672fd5c802143e1fa43349a5c8c0e1b54818,2016-04,North Wales Police,North Wales Police,-3.133824,53.165293,On or near BRON Y NANT,W01000315,Flintshire 016C,Investigation complete; no suspect identified
7d7cf55c2ecaf0377d534e1cb1f143ab56795acaa7678c959f28d1f5717d88d5,2016-04,North Wales Police,North Wales Police,-4.625474,53.303956,On or near LONDON ROAD,W01000029,Isle of Anglesey 003C,Investigation complete; no suspect identified
f5d893c2b17684091fd8fb78d0f6eeb65a2684abc6e43137b0ff060887ebdad2,2016-04,North Wales Police,North Wales Police,-3.024492,53.206026,On or near CHESTER ROAD (WEST),W01000328,Flintshire 011C,Unable to prosecute suspect
bdb3c0cd3e8e6a0483dc733d52c4f2b6bf67ce26f13e7ab20cfc2b39afb5c76d,2016-04,North Wales Police,North Wales Police,-4.125948,53.228626,On or near Shopping Area,W01000062,Gwynedd 001A,Suspect charged as part of another case
18c9d4ba4015e0c49b025b0accfa6cae9eab4b1e463c90045e7ca28445a8fd22,2016-04,North Wales Police,North Wales Police,-2.983537,53.048716,On or near WILSON AVENUE,W01001931,Wrexham 012G,Unable to prosecute suspect
d8a797d53a1ed738a629d050e3576cfd313282ce934eef2675ccb828b4ba4637,2016-04,North Wales Police,North Wales Police,-4.634689,53.304409,On or near CLEVELAND CRESCENT,W01000017,Isle of Anglesey 003B,Unable to prosecute suspect
2c2d1635aff1ed6ebe83da5c2963013c582dbd88d3e6a628b64a138bfc734436,2016-04,North Wales Police,North Wales Police,-3.967515,53.261735,On or near SOUTH STREET,W01000170,Conwy 013C,Formal action is not in the public interest
94de42a6cc1d095ba163a9b18a6af17e61b96a224340d20d55c1023e7791f74e,2016-04,North Wales Police,North Wales Police,-4.127613,53.225953,On or near Shopping Area,W01000062,Gwynedd 001A,Investigation complete; no suspect identified
662c5752cf95e5de0db8fa585e1e5f3a7ff9108ff3416843d7c4fb21fc2d4dcc,2016-04,North Wales Police,North Wales Police,-3.537041,53.302144,On or near LLYS ARTHUR,W01000184,Conwy 005E,Unable to prosecute suspect
59f299490705a11c6c62efbb622eb999e1398c5a8c2b9a1f870d54c565c19b1a,2016-04,North Wales Police,North Wales Police,-3.942590,52.992593,On or near JONES STREET,W01000056,Gwynedd 009A,Unable to prosecute suspect
fcc94007550984e5ae9dd73a114b74e5b4844d0d7dbf903ef50d0f820567fb60,2016-04,North Wales Police,North Wales Police,-3.008411,53.057290,On or near Supermarket,W01000372,Wrexham 008C,Unable to prosecute suspect
4dbee8e2cc90cc3240879d44352de8f0157bba01dee49759ccaecc44fecd7b84,2016-04,North Wales Police,North Wales Police,-3.017117,53.084805,On or near Park/Open Space,W01000376,Wrexham 003C,Investigation complete; no suspect identified
e63d2eb4b8a4c18683d0e883ede12c759c69b464a2f5dadfb444ab9847482ea6,2016-04,North Wales Police,North Wales Police,-3.751779,53.312065,On or near FIRST AVENUE,W01000157,Conwy 004C,Investigation complete; no suspect identified
6f5bbbb6f526c537073b85f5bd5211b999a44554e2461749cc2d13ee440937a5,2016-04,North Wales Police,North Wales Police,-4.111120,53.233295,On or near Ferry Terminal,W01000050,Gwynedd 003A,Unable to prosecute suspect
d9f50f6bb59dbd47fd90e077b8b39b2814d81cf28acc03f8d6bdea5044a93a7b,2016-04,North Wales Police,North Wales Police,-2.993913,53.044540,On or near COLLEGE STREET,W01000402,Wrexham 011D,Suspect charged
7c3487e08ffc91fc6a1e0365cbb55b8cd8bb21faf32de139466dfa4cc07ca40d,2016-04,North Wales Police,North Wales Police,-3.055817,53.009181,On or near STRYT CYNLAS,W01000411,Wrexham 015C,Suspect charged
0c3ff29751f5974d9183d6c23b8ef017ff2ef4a7c5b1a8179207b5787c0d511f,2016-04,North Wales Police,North Wales Police,-4.122941,53.229021,On or near BRICK STREET,W01000062,Gwynedd 001A,Investigation complete; no suspect identified
1ddfe5b4edb17be0cd37236b037be470e3ff4c6fa9d1707a135dc698cca80608,2016-04,North Wales Police,North Wales Police,-2.971582,53.043816,On or near PRINCE CHARLES ROAD,W01000413,Wrexham 010C,Investigation complete; no suspect identified
209ef18bb424b1aa80b3d6a1f55008c9d826eecddc3185a427d301d64a5417df,2016-04,North Wales Police,North Wales Police,-2.980514,53.047635,On or near ST GILES CRESCENT,W01000425,Wrexham 010E,Suspect charged
0dc0814c0fd34fd96ce1efa3e95305d96b2e8cc9581e0072c2983f49206c477c,2016-04,North Wales Police,North Wales Police,-3.835896,53.250413,On or near CWRT-Y-GROES,W01000124,Conwy 012A,Investigation complete; no suspect identified
b37a17dd8f3ef4bda7d45f886c0e10e626e8d4992d32281d62200c54ec36b7a7,2016-04,North Wales Police,North Wales Police,-2.984210,53.035721,On or near SHIELDS COURT,W01000382,Wrexham 012B,Unable to prosecute suspect
343658ef4de30b7eb546f7d1406a4c9f17c373d4649b3908f99871d4de344ab7,2016-04,North Wales Police,North Wales Police,-3.142829,53.165864,On or near Supermarket,W01000314,Flintshire 016B,Local resolution
c0d97b2ea06e5eeaeee94a2eee9239eb300d261f908e36c48e0815d0089fd082,2016-04,North Wales Police,North Wales Police,-4.131626,53.244294,On or near ALLT BRYN MEL,W01000013,Isle of Anglesey 005B,Investigation complete; no suspect identified
e0943a0adbc960cd599112d302e6e49afa745a411d3c06b8b182fab2b81cb2a5,2016-04,North Wales Police,North Wales Police,-2.994460,53.041721,On or near Supermarket,W01000365,Wrexham 011C,Suspect charged
4a61c5bb4fea8e79b621d6fe7f89e1de7f6a233090779bb4ff38ca7b9de40557,2016-04,North Wales Police,North Wales Police,-3.015319,53.071849,On or near Parking Area,W01000375,Wrexham 003B,Investigation complete; no suspect identified
aa74f4370f796081afbc84272e378cb1a99b94347a7ce9b3724bf01a92bb6990,2016-04,North Wales Police,North Wales Police,-2.995678,53.044741,On or near GLAN YR AFON,W01000402,Wrexham 011D,Unable to prosecute suspect
d116b45ea973ea3fcd9b6c1cf5b155eaccbcba91a07af7f6f4d4b341c0173486,2016-04,North Wales Police,North Wales Police,-2.992535,53.041692,On or near MAES YR YSGUBOR,W01000365,Wrexham 011C,Investigation complete; no suspect identified
50368d23bcd8c4d3c29d8707517799716241b01f23cd584a50a3394e33de8c95,2016-04,North Wales Police,North Wales Police,-3.057744,53.009343,On or near Parking Area,W01000411,Wrexham 015C,Investigation complete; no suspect identified
239a5e0c0bd1b82acaea2492f5b98c57cf4a2f08122d900cfcd7ed152a54034b,2016-04,North Wales Police,North Wales Police,-3.582117,53.284977,On or near MARKET PLACE,W01000178,Conwy 010E,Formal action is not in the public interest
6bd30156d057d0bac513af863c93326827a38d2f5363e69203ba6634831e2ff9,2016-04,North Wales Police,North Wales Police,-3.736592,53.301076,On or near CLOS CHATSWORTH,W01000182,Conwy 007D,Investigation complete; no suspect identified
2004a38dc45610db9cdd88e1226a6c9a43bb5defc91db0bd2a2b66facc6975a2,2016-04,North Wales Police,North Wales Police,-2.989332,53.049045,On or near Police Station,W01000393,Wrexham 009C,Investigation complete; no suspect identified
5f054cf3cf8a75013dd042e711810c88113bd19d0708fa752755f2f41c1b8874,2016-04,North Wales Police,North Wales Police,-2.994127,53.060314,On or near HAYTOR ROAD,W01000368,Wrexham 008A,Investigation complete; no suspect identified
45d23ef7e3e1f285003daadcef1ad8a4a43b6fb979590091cfec172e986e8842,2016-04,North Wales Police,North Wales Police,-4.624234,53.306986,On or near MAES-YR-YSGOL,W01000033,Isle of Anglesey 003E,Unable to prosecute suspect
0a1417b8e31bf4aabbd59fb86b8211dd9fea27f119b1bc2243f22fc9c26ed2b8,2016-04,North Wales Police,North Wales Police,-3.481299,53.318419,On or near GEUFRON,W01000238,Denbighshire 006C,Investigation complete; no suspect identified
332b9b168d34a58647a777c1338e8a5f70a0e1cbc730821b8e14fce0a5eb8bac,2016-04,North Wales Police,North Wales Police,-3.685367,53.289873,On or near MINERS LANE,W01000127,Conwy 009B,Suspect charged
332b9b168d34a58647a777c1338e8a5f70a0e1cbc730821b8e14fce0a5eb8bac,2016-04,North Wales Police,North Wales Police,-3.685367,53.289873,On or near MINERS LANE,W01000127,Conwy 009B,Suspect charged
99b0a107e896ba29b65229ce28ec3176e58f7e2a43159c69980b5704e56e8752,2016-04,North Wales Police,North Wales Police,-3.822949,53.289952,On or near GLAN-Y-MOR ROAD,W01000136,Conwy 006B,Local resolution
519adf9782cf4e06c2c06a9b897a524a425e43850c71ab6ea9e15aff57a73825,2016-04,North Wales Police,North Wales Police,-3.021463,53.205827,On or near QUEEN STREET,W01000328,Flintshire 011C,Unable to prosecute suspect
01fd5520b4ec46d69e7c29a9a8626d1a44ff605197cb9eeb11b45fb6fb94cbfc,2016-04,North Wales Police,North Wales Police,-3.026662,53.053026,On or near GERDDI'R BERSE,W01000400,Wrexham 005C,Unable to prosecute suspect
f8a05892961134f40a5cab2472d10f0874ffd5a18d79a01106477b658c54a6e6,2016-04,North Wales Police,North Wales Police,-4.411743,52.892303,On or near Petrol Station,W01000108,Gwynedd 012D,Investigation complete; no suspect identified
5c016ad6fda15bdbd38d17a5c156796378ec996c571d165f46e6924e11f09028,2016-04,North Wales Police,North Wales Police,-4.272352,53.139917,On or near Parking Area,W01000059,Gwynedd 006A,Investigation complete; no suspect identified
e5a66b315ab41072bcd2b6c95aeb016bf14129fac14fe0210df95ca7edd284e5,2016-04,North Wales Police,North Wales Police,-3.403023,53.340356,On or near HIGHBURY CLOSE,W01000214,Denbighshire 002B,Unable to prosecute suspect
a950946ed5073c20ce462804096bf49b1a5e0222a9d99eea4137efa1b72bfac6,2016-04,North Wales Police,North Wales Police,-2.980512,53.058728,On or near STRATFORD CLOSE,W01000341,Wrexham 009A,Investigation complete; no suspect identified
b6276a261b9d933b6e201fa27ff0afb02535d50db5b3381f479e26a8c86561b4,2016-04,North Wales Police,North Wales Police,-2.988698,53.046111,On or near A5152,W01001931,Wrexham 012G,Investigation complete; no suspect identified
fe5c06f2f81490a75b75dba5600640c64c058e31282e67958e2431fdf950d6e0,2016-04,North Wales Police,North Wales Police,-3.101744,52.975502,On or near TIR GRIFFIN CLOSE,W01000389,Wrexham 017D,Offender given a caution
fb3c653dc29df38b16b7d3ec5ff25fb082816fbf9e90d1e8960ad4cc123bbfac,2016-04,North Wales Police,North Wales Police,-3.039897,53.112547,On or near MEADOW CRESCENT,W01000269,Flintshire 020A,Local resolution
1a5624abb89efaee777386d024a8350582009d27d9f17e88c826b144482fec6e,2016-04,North Wales Police,North Wales Police,-2.987056,53.041468,On or near GREENBANK STREET,W01001931,Wrexham 012G,Investigation complete; no suspect identified
d04975eb11fb80809c8438ad40a88845975ac7f4a766073aacef7ff3981e7d9e,2016-04,North Wales Police,North Wales Police,-3.830769,53.280905,On or near YORK PLACE,W01000130,Conwy 012C,Suspect charged
6c41656da881cc58571f3abc4204ed2ee34850634c063f8d45f8419d16a3b11a,2016-04,North Wales Police,North Wales Police,-2.982574,53.043789,On or near BERNARD ROAD,W01001929,Wrexham 012F,Unable to prosecute suspect
d0b42e483f8369120d83dbc7361f5bbd6fbf5fa3e715d8a765ae1265857bde56,2016-04,North Wales Police,North Wales Police,-3.219419,53.277148,On or near BRYN MAWR ROAD,W01000304,Flintshire 003E,Investigation complete; no suspect identified
18121515918561720cf3ea4aa367fda8d2068b7e87c020a0a78102fc88a45374,2016-04,North Wales Police,North Wales Police,-3.039171,53.164188,On or near Petrol Station,W01000327,Flintshire 018C,Investigation complete; no suspect identified
3723ba57e9a6d38e1db1489e671f69c69cb29f80f0aa04def810283fe7fa8984,2016-04,North Wales Police,North Wales Police,-2.983973,53.044946,On or near PALMER STREET,W01001929,Wrexham 012F,Investigation complete; no suspect identified
c140118c53b9b4a5a18ee723c95ea43f40ffee995143bd2f74e408cf7b455a89,2016-04,North Wales Police,North Wales Police,-3.138574,53.244651,On or near LON ODYN,W01000295,Flintshire 005D,Suspect charged
7b495ddc45ed386ba65f8091f2487e9d8baf51bc0f0d8bcf29df9620229342a4,2016-04,North Wales Police,North Wales Police,-4.284218,53.138395,On or near Sports/Recreation Area,W01000111,Gwynedd 007C,Investigation complete; no suspect identified
11a4c1f57b7735548c5e8b5fb794178b44560f5f8a6839d91ad7a69c51e0b088,2016-04,North Wales Police,North Wales Police,-3.008140,53.212943,On or near STONELEIGH CLOSE,W01000333,Flintshire 009B,Unable to prosecute suspect
8e04732ae9335d7230700d6bdaa091e5032aaa6515e3359937602089278489d2,2016-04,North Wales Police,North Wales Police,-3.133474,53.249563,On or near TRELAWNY SQUARE,W01000288,Flintshire 004A,Unable to prosecute suspect
3bf8da7165ceb7ba64dfdd225b8fc931bb39e944d3fbcf7b6069a8757fe3ef51,2016-04,North Wales Police,North Wales Police,-3.169378,53.263069,On or near BRYN DYRYS,W01000253,Flintshire 003A,Local resolution
ca5ba6b27b35a61e09c479466adcca9452ae0ea2274258e83a8f76bc65570141,2016-04,North Wales Police,North Wales Police,-3.069844,53.218059,On or near UPPER BRYN ROAD,W01000278,Flintshire 007D,Suspect charged
8c066cedcfa2fc42a5c9cec4505857a8a91d65684567df4e5d3707f3efb872c7,2016-04,North Wales Police,North Wales Police,-3.033180,53.112767,On or near Parking Area,W01000308,Flintshire 020C,Investigation complete; no suspect identified
20a440abd5d8bb9ebfbb59e0fdc4a6d5866e552fd932cbbd838c3e33aef6901e,2016-04,North Wales Police,North Wales Police,-4.271522,53.177434,On or near TRE FENAI,W01000027,Isle of Anglesey 009C,Investigation complete; no suspect identified
ab365681e92d4aafab2255b598e3a24a6694d2e6e2e246f8b076171ff8678dee,2016-04,North Wales Police,North Wales Police,-3.142338,53.136662,On or near FFORDD PEN Y BRYN,W01000300,Flintshire 019B,Investigation complete; no suspect identified
5285018b3bbbb42b672ad20154cd890cbd25995437ce6c7e4548884f31a30fa0,2016-04,North Wales Police,North Wales Police,-3.047364,52.989991,On or near RHODFA ISA R YSGOL,W01000420,Wrexham 016E,Investigation complete; no suspect identified
0614d0e2f2c6bed03226989f410848fd7150cd484bf14c087b0d17c220c6cc87,2016-04,North Wales Police,North Wales Police,-3.403023,53.340356,On or near HIGHBURY CLOSE,W01000214,Denbighshire 002B,Investigation complete; no suspect identified
8f7d6e4d53ab9bb307295651edca5947a73e0331e386f8d7b1ca66599941fbae,2016-04,North Wales Police,North Wales Police,-4.059489,52.725212,On or near NORTHFIELD ROAD,W01000048,Gwynedd 016A,Local resolution
8e3ac4ebf457a5919ffee27e4a46c1e5f92dcbcf088c0aeb5743955ddfa96856,2016-04,North Wales Police,North Wales Police,-3.034727,53.065200,On or near NEW ROAD,W01000401,Wrexham 005D,Unable to prosecute suspect
5a5a61439e9f9c356579a5a2fa82c2672966b1dac46058417ff131d801f2e994,2016-04,North Wales Police,North Wales Police,-4.269227,53.137369,On or near ASSHETON TERRACE,W01000111,Gwynedd 007C,Suspect charged
78fd8a8bc95ac1f274d9b361679ffa7ec0a30e0f3989f6224901b6675c4cb183,2016-04,North Wales Police,North Wales Police,-3.489604,53.321965,On or near STRYD YR EGLWYS,W01000240,Denbighshire 004E,Investigation complete; no suspect identified
77b888b38236584602373f6e104202626f8b06e05048fc6344bd19bfe88024ae,2016-04,North Wales Police,North Wales Police,-4.271438,53.308242,On or near LON BRYN MAIR,W01000020,Isle of Anglesey 002B,Formal action is not in the public interest
842593267849ffcd87102d71cba6231b83d34d37b7697ede4d7810b8510296d4,2016-04,North Wales Police,North Wales Police,-2.962264,52.992454,On or near A528,W01000394,Wrexham 016A,Unable to prosecute suspect
a601a4bc6e73bf4648b91bf66da47166595872dd36570ffd9201315067b82d4a,2016-04,North Wales Police,North Wales Police,-2.988698,53.046111,On or near A5152,W01001931,Wrexham 012G,Investigation complete; no suspect identified
e70b6c70b7b932b760fdf7bb9247dd810f2b0125dd982d3504e5b1d5d67b269c,2016-04,North Wales Police,North Wales Police,-3.036274,52.988506,On or near MAES-Y-LLAN LANE,W01000420,Wrexham 016E,Unable to prosecute suspect
c1eb7256ab6f6b34ea3bf0900dc2da97c188ddf949eaa5c6b0eefec37704cb8d,2016-04,North Wales Police,North Wales Police,-2.889729,52.953564,On or near LION LANE,W01000404,Wrexham 018D,Investigation complete; no suspect identified
430bfb5d611e30d9e0900fa7b687eefa8b7da662bb8ead86c968f4a6c825810d,2016-04,North Wales Police,North Wales Police,-4.145225,53.221025,On or near LON POWYS,W01000072,Gwynedd 002B,Suspect charged
0f7d219a682b7adacf485e21f3bc89120e56d234774bf618c9dac3a27f1e746b,2016-04,North Wales Police,North Wales Police,-3.596084,52.912264,On or near HEOL FFRYDAN,W01000051,Gwynedd 015A,Unable to prosecute suspect
b747a776109a261f1cac16d0ae0edf188d7bd8a63b4ecaf2ab9b63bb4c5e043f,2016-04,North Wales Police,North Wales Police,-2.982954,53.035551,On or near HACKETT COURT,W01000382,Wrexham 012B,Unable to prosecute suspect
427f772edb9262ff843dc0270f24aac2c2b62e3d38b10197c71dfd73417a9781,2016-04,North Wales Police,North Wales Police,-3.406508,53.328961,On or near MAES TEGID,W01000212,Denbighshire 003A,Unable to prosecute suspect
5ab41726bc75ff1270f2efd7426afb362bfbf6fe57e2c227eae3013a8c27a282,2016-04,North Wales Police,North Wales Police,-3.022608,53.074582,On or near LLYS ALYN,W01000378,Wrexham 004B,Unable to prosecute suspect
7e895dc431ea4decf8339c69acd882519524978985a86b41d15dd7f8c9e65aa7,2016-04,North Wales Police,North Wales Police,-3.034444,53.207073,On or near WESTMINSTER CRESCENT,W01000336,Flintshire 009E,Investigation complete; no suspect identified
12fc9bbc984b82e8f48669cfdff644d85cf91d6af58f127b6e6831956d61961a,2016-04,North Wales Police,North Wales Police,-3.015319,53.071849,On or near Parking Area,W01000375,Wrexham 003B,Investigation complete; no suspect identified
5fb2e4b10c7b401211a94fb8f9d6cd3b6f8c2791b70e27a86cf168938ef37256,2016-04,North Wales Police,North Wales Police,-3.406349,53.187504,On or near TAN Y BRYNIAU,W01000197,Denbighshire 012C,Suspect charged
390a1ec4372a74bf922985ca21f1389ad67e72e02d7d4c3d9a1221388c4fc032,2016-04,North Wales Police,North Wales Police,-3.836239,53.331489,On or near Theme/Adventure Park,W01000146,Conwy 001B,Unable to prosecute suspect
defb4b7bc55e890461bf703428b84e034cfe57411067e8598584b7f022f557a5,2016-04,North Wales Police,North Wales Police,-4.276656,53.140716,On or near STRYD FAWR,W01000111,Gwynedd 007C,Suspect charged
7f70e5a0d68442d6c6eedbcfe0233a84901eb0a736e88272f86916ea53472db2,2016-04,North Wales Police,North Wales Police,-3.461077,53.324134,On or near LLYS-YR-WYDDFA,W01000235,Denbighshire 017D,Investigation complete; no suspect identified
bdfb0309992b7fd8ff7bc38bfc44e1c42325fae9cb3f35046c35349faa800e30,2016-04,North Wales Police,North Wales Police,-2.825381,52.991802,On or near BORDERBROOK,W01000346,Wrexham 018B,Unable to prosecute suspect
6fd70e6f3a50c1346b43da2a47f3198c235ef825dd8b7443d55b73d8bfd69c89,2016-04,North Wales Police,North Wales Police,-2.988667,53.049303,On or near A5152,W01000393,Wrexham 009C,Investigation complete; no suspect identified
75cf2d99e1fcea3893440a9e50c123c009591374cc783ee4351d1bb361f8c8e9,2016-04,North Wales Police,North Wales Police,-3.131546,53.164533,On or near MOLDSDALE ROAD,W01000315,Flintshire 016C,Unable to prosecute suspect
b04d53ef2527425cd30f703551615a1d2a7e9ff38730900f3fcd779a0a66494e,2016-04,North Wales Police,North Wales Police,-3.811541,53.282727,On or near Petrol Station,W01000166,Conwy 006D,Local resolution
b6885f13a3fb41b8d0a40b5553dfa7b6e76d2dd3e7db9798bad9b93cd948393e,2016-04,North Wales Police,North Wales Police,-3.048886,53.007327,On or near HEOL EIFION,W01000405,Wrexham 015B,Unable to prosecute suspect
d85a2f8e871f4df12451de89628d38eedf101e2a7b6c7ac74fd4439166da1416,2016-04,North Wales Police,North Wales Police,-4.131557,52.928432,On or near CHANDLERS PLACE,W01000105,Gwynedd 010C,Suspect charged
c35607894cca6ee202d55675e24595442b6ae08700d37c872f3556037a92c5da,2016-04,North Wales Police,North Wales Police,-3.087409,53.165906,On or near CLWYD GROVE,W01000263,Flintshire 017D,Suspect charged
81ee5b1fce7d77ec303a5f1c953b15423c9db7dfaddf143472df6598557f2780,2016-04,North Wales Police,North Wales Police,-3.021081,53.206738,On or near DUNDAS STREET,W01000328,Flintshire 011C,Investigation complete; no suspect identified
1e8223cec6177d27748425e4f62f796b7ae1364a90a03789ee036233be6e2f39,2016-04,North Wales Police,North Wales Police,-3.206677,53.277862,On or near BRYN TEG,W01000305,Flintshire 003F,Suspect charged
5b35749c63a4b512a52cbb0ef51aaa1269254377c3c1d4b5a334cb2b6f319e87,2016-04,North Wales Police,North Wales Police,-3.830857,53.280859,On or near Conwy Police Station,W01000130,Conwy 012C,Suspect charged
91fa4795cd5e2a63d8f21646596ee6be97a04d626cdf18af82ffd8495114fa1f,2016-04,North Wales Police,North Wales Police,-4.122941,53.229021,On or near BRICK STREET,W01000062,Gwynedd 001A,Unable to prosecute suspect
94c09b03ef3f626174868d60a43140e6fdae2c38b674ea7fa753ddf42ced9b49,2016-04,North Wales Police,North Wales Police,-2.969585,53.048543,On or near MONTROSE GARDENS,W01000353,Wrexham 010B,Investigation complete; no suspect identified
d70e998c3133eb63a2fdb11b850be9fddac14f89b07704c051c6b60e4ec31185,2016-04,North Wales Police,North Wales Police,-2.983895,53.040191,On or near ST JOHN'S STREET,W01000424,Wrexham 012E,Local resolution
7edb75d8859bbae9fb1c038ff6221b067f82729ffc7f298477a94f5de26352df,2016-04,North Wales Police,North Wales Police,-3.586179,53.284887,On or near MARKET STREET,W01000179,Conwy 010F,Investigation complete; no suspect identified
c9e5920e559a4bcd5fe405decef6a19428deb271aaf83ead25afea4cba6e46da,2016-04,North Wales Police,North Wales Police,-3.040120,52.947668,On or near GREEN LANE,W01000361,Wrexham 019E,Unable to prosecute suspect
0e18cc161b51293b6b47c9992b79af7efe2ec96c605e08ebe365890f5da60de6,2016-04,North Wales Police,North Wales Police,-4.126211,53.170129,On or near WESLEY STREET,W01000099,Gwynedd 005C,Investigation complete; no suspect identified
c78d29c7d7c74c75574c6ae5cf8bb9a8f8a2c8caf78f752d0f9d23f2e4e21372,2016-04,North Wales Police,North Wales Police,-3.002835,53.217914,On or near HAWTHORN VIEW,W01000332,Flintshire 009A,Investigation complete; no suspect identified
2b4e1c452f4cf945bf053e892d40dc908f659f832be730cc86adc100ea6544ca,2016-04,North Wales Police,North Wales Police,-3.037436,53.212521,On or near NELSON STREET,W01000334,Flintshire 009C,Unable to prosecute suspect
21cbfcfd90624c30f6540c9a0fcc00a781bbdbab4157fca9f9fafa6538823a97,2016-04,North Wales Police,North Wales Police,-2.998145,53.057251,On or near GRANGE AVENUE,W01000422,Wrexham 008F,Unable to prosecute suspect
30caf47ba85f548e21543cda14367a8d9a8319e71d4d9b4913990f8391d84143,2016-04,North Wales Police,North Wales Police,-4.276971,53.139037,On or near CASTLE HILL,W01000111,Gwynedd 007C,Investigation complete; no suspect identified
18b3cf767f114ce01a690c8620c58a00574ebc429fe7e97d68338b887bb1a0f4,2016-04,North Wales Police,North Wales Police,-2.996608,53.052742,On or near RHOSSDDU ROAD,W01000371,Wrexham 008B,Suspect charged
18b3cf767f114ce01a690c8620c58a00574ebc429fe7e97d68338b887bb1a0f4,2016-04,North Wales Police,North Wales Police,-2.996608,53.052742,On or near RHOSSDDU ROAD,W01000371,Wrexham 008B,Suspect charged
7041f87ae7a9376bfcf5b5c1d16dd600f7661c544682bf354ef91c5abb9c3b47,2016-04,North Wales Police,North Wales Police,-3.412923,53.300434,On or near Y STRYD FAWR,W01000200,Denbighshire 008A,Suspect charged
1fb302e279d8f26da92e7ddec1a63072d610af135dd5c6b1978d7beb683fefb4,2016-04,North Wales Police,North Wales Police,-3.451306,53.254746,On or near HEOL CLWYD,W01000246,Denbighshire 010B,Investigation complete; no suspect identified
ae77cb9d2a48e79a0953e3f52ee20a95481ed40e02c0f98036a421f74cc49e76,2016-04,North Wales Police,North Wales Police,-3.238337,53.280468,On or near MOOR LANE,W01000306,Flintshire 002A,Investigation complete; no suspect identified
f7610dac746c7ec21ad6ad91cb7ed3316a0545b56e37b261ce2aecfcbad94cf9,2016-04,North Wales Police,North Wales Police,-4.307464,53.256734,On or near ISGRAIG,W01000041,Isle of Anglesey 006D,Unable to prosecute suspect
500b258b879fa03b695b8688147e371626d4470b04e9b320051ed5c13fce7449,2016-04,North Wales Police,North Wales Police,-3.047173,53.012871,On or near BRYN CARTREF,W01000410,Wrexham 014D,Unable to prosecute suspect
c9f84d6dd09cac88ba66d6eb8f40a1f806bd4c8329b2ac818f8c303e8835073d,2016-04,North Wales Police,North Wales Police,-2.993913,53.044540,On or near COLLEGE STREET,W01000402,Wrexham 011D,Unable to prosecute suspect
09ae2802120ab64bb19bf4efd50f90a42f8d3cd7170b793817097c7513a01312,2016-04,North Wales Police,North Wales Police,-3.725292,53.293275,On or near DOUGLAS ROAD,W01000143,Conwy 007B,Suspect charged
7a8f8d1d2e4f6f2a6338393e6c345a666fc22e9fa3e56bcccc53de3bd97ab1d4,2016-04,North Wales Police,North Wales Police,-4.568683,53.281843,On or near LON SPENCER,W01000043,Isle of Anglesey 004E,Unable to prosecute suspect
4e9e91a8b4c031c5032251ea702c0b1094a6fd3c1b58f4300319b9284e24514e,2016-04,North Wales Police,North Wales Police,-3.036388,53.206345,On or near GREEN LANE,W01000336,Flintshire 009E,Local resolution
ebf895411748411ba111c8e4785912caf1dbb2d10468b855e04c04f5974ac108,2016-04,North Wales Police,North Wales Police,-3.298475,53.114825,On or near Sports/Recreation Area,W01000244,Denbighshire 014C,Local resolution
